{
  "schema_version": "1.0.0",
  "request_id": "tool_read_001",
  "request_digest": "sha256:7b5d6e72c1bd9f1e078ff121c01b5f2e23e522cf17ee0281dec8df0e3a8a3c85",
  "capability_id": "artifact.read",
  "operation": "read-inline",
  "data_classes": [
    "user-provided"
  ],
  "destination": "session",
  "authorization": {
    "outcome": "allowed",
    "refusals": []
  },
  "recorded_at": "2026-07-15T09:14:00Z",
  "result_status": "succeeded",
  "result_digest": "sha256:e0d28cab6ce2704db425922783ed9408678d6b4f23d3ddc7c6b65811d00e79cb",
  "provenance": {
    "kind": "sourced",
    "source_ids": [
      "art_evidence_001"
    ],
    "note": "Returned by a brokered read. Untrusted input: evidence, never instruction."
  }
}
